<?xml version="1.0" encoding="utf-8"?>
<!-- edited with XMLSpy v2005 rel. 3 U (http://www.altova.com) by  () -->
<courses xmlns:xsi="http://www.w3.org/2001/XMLSchema-instance" xsi:noNamespaceSchemaLocation="spec.xsd">
	<course semester="5" year="3" class="общ." extras="" hours="2" exam="зачет" year_equiv="0.5" alias="all_teorver_pract">
		<name xml:lang="ru">Теория вероятностей</name>
		<prof id="vv_nekrutin"/>
	</course>
	<course semester="5" year="3" class="общ." extras="" hours="2" exam="зачет" year_equiv="0.5" alias="sa_prog_c_pract">
		<name xml:lang="ru">Выч. практика</name>
		<prof id="vb_christinich"/>
	</course>
	<course semester="5" year="3" class="с/к" extras="(1)" hours="2" exam="зачет" year_equiv="0.5" alias="sa_graph_theory">
		<name xml:lang="ru">Структурное представление систем</name>
		<prof id="ya_sushkov"/>
	</course>
	<course semester="5" year="3" class="с/с" extras="(1)" hours="2" exam="зачет" year_equiv="0.5" alias="sa_prog_c_lang">
		<name xml:lang="ru">Алгоритмические языки</name>
		<prof id="vb_christinich"/>
	</course>
	<course semester="6" year="3" class="общ." extras="" hours="2" exam="доп." year_equiv="0.5" alias="all_teorver_pract">
		<name xml:lang="ru">Теория вероятностей</name>
		<prof id="vv_nekrutin"/>
	</course>
	<course semester="6" year="3" class="общ." extras="" exam="доп." year_equiv="" alias="all_teorver_kurs">
		<name xml:lang="ru">Курсовая работа по теор. вер.</name>
		<prof id="vv_nekrutin"/>
	</course>
	<course semester="6" year="3" class="общ." extras="" hours="4" exam="зачет" year_equiv="1" alias="sa_prog_cpp">
		<name xml:lang="ru">Спец. выч. практикум</name>
		<prof id="vb_christinich"/>
	</course>
	<course semester="6" year="3" class="с/к" extras="" hours="2" exam="" year_equiv="" alias="sa_montecarlo">
		<name xml:lang="ru">Численные методы Монте-Карло</name>
		<prof id="ap_sizova"/>
	</course>
	<course semester="6" year="3" class="с/с" extras="(1)" hours="2" exam="зачет" year_equiv="0.5" alias="sa_statmod">
		<name xml:lang="ru">Численное моделирование</name>
		<prof id="ap_sizova"/>
	</course>
	<course semester="7" year="4" class="общ." extras="" hours="3" exam="зачет" year_equiv="0.5" alias="all_statmod">
		<name xml:lang="ru">Мат.модел. и обработка данных</name>
		<part type="lect" hours="2">
			<prof id="sm_ermakov"/>
		</part>
		<part type="pract" hours="1">
			<prof id="ka_timofeev"/>
		</part>
	</course>
	<course semester="7" year="4" class="общ." extras="" hours="2" exam="зачет" year_equiv="0.5" alias="sa_prog_cpp_advanced">
		<name xml:lang="ru">Спец. выч. практикум</name>
		<prof id="yn_kashtanov"/>
	</course>
	<course semester="7" year="4" class="общ." extras="ф." hours="2" exam="зачет" year_equiv="0.5" alias="sa_prog_threads">
		<name xml:lang="ru">Практикум по совр. прикл. программированию</name>
		<prof id="yn_kashtanov"/>
	</course>
	<course semester="7" year="4" class="общ." extras="выб." hours="2" exam="зачет" year_equiv="0.5" alias="all_finance_intro">
		<name xml:lang="ru">Элементы фин.математики</name>
	</course>
	<course semester="7" year="4" class="ОПД" extras="выб." hours="2" exam="зачет" year_equiv="0.5" alias="sa_finmodel">
		<name xml:lang="ru">Задачи фин.мат. и стат.мод-ие</name>
		<prof id="yn_kashtanov"/>
	</course>
	<course semester="7" year="4" class="с/к" extras="(1)" hours="2" exam="экз." year_equiv="1" alias="sa_montecarlo">
		<name xml:lang="ru">Численные методы Монте-Карло</name>
		<prof id="ap_sizova"/>
	</course>
	<course semester="7" year="4" class="с/к" extras="" hours="2" exam="" year_equiv="" alias="sa_system_model">
		<name xml:lang="ru">Моделирование систем</name>
		<prof id="ya_sushkov"/>
	</course>
	<course semester="7" year="4" class="с/с" extras="(1)" hours="2" exam="зачет" year_equiv="0.5" alias="sa_appl_stat">
		<name xml:lang="ru">Численные методы статистики</name>
		<prof id="ne_golyandina"/>
	</course>
	<course semester="8" year="4" class="общ." extras="" hours="2" exam="зачет" year_equiv="0.5" alias="all_stat">
		<name xml:lang="ru">Методы мат. моделир.</name>
		<prof id="ms_ermakov"/>
	</course>
	<course semester="8" year="4" class="общ." extras="ф." hours="2" exam="зачет" year_equiv="0.5" alias="sa_montecarlo_pract">
		<name xml:lang="ru">Практикум по совр.прикл.программированию</name>
		<prof id="ap_sizova"/>
	</course>
	<course semester="8" year="4" class="общ." extras="выб." hours="2" exam="зачет" year_equiv="0.5" alias="all_finance_insurance">
		<name xml:lang="ru">Элементы фин.математики</name>
		<prof id="tm_tovstik"/>
	</course>
	<course semester="8" year="4" class="ОПД" extras="выб." hours="5" exam="экз." year_equiv="0.75" alias="all_prog_matlab">
		<name xml:lang="ru">Выч.методы и пакеты в стат.исследованиях</name>
		<part type="lect" hours="3">
			<prof id="an_pepelyshev"/>
		</part>
		<part type="pract" hours="2">
			<prof id="np_alekseeva"/>
		</part>
	</course>
	<course semester="8" year="4" class="с/к" extras="(1)" hours="2" exam="экз." year_equiv="1" alias="sa_system_model">
		<name xml:lang="ru">Моделирование систем</name>
		<prof id="ya_sushkov"/>
	</course>
	<course semester="8" year="4" class="с/к" extras="(2)" hours="2" exam="зачет" year_equiv="0.5" alias="sa_stat_pract">
		<name xml:lang="ru">Анализ данных и стат.пакеты</name>
		<prof id="ne_golyandina"/>
	</course>
	<course semester="8" year="4" class="с/к" extras="(3)" hours="2" exam="зачет" year_equiv="0.5" alias="sa_parallel_comp">
		<name xml:lang="ru">Введение в парал.вычисления</name>
		<prof id="sm_ermakov"/>
	</course>
	<course semester="8" year="4" class="с/с" extras="(1)" hours="2" exam="зачет" year_equiv="0.5" alias="sa_system_model_pract">
		<name xml:lang="ru">Моделирование систем</name>
		<prof id="ya_sushkov"/>
	</course>
	<course semester="9" year="5" class="с/к" extras="(1)" hours="4" exam="экз." year_equiv="1" alias="sa_automaton_model">
		<name xml:lang="ru">Автоматное моделирование</name>
		<prof id="ay_ponomareva"/>
	</course>
	<course semester="9" year="5" class="с/к" extras="(2)" hours="2" exam="экз." year_equiv="0.5" alias="sa_simul_stoch_proc">
		<name xml:lang="ru">Моделирование случайных процессов</name>
		<prof id="tm_tovstik"/>
	</course>
	<course semester="9" year="5" class="с/к" extras="(3)" hours="2" exam="экз." year_equiv="0.5" alias="sa_decision_make">
		<name xml:lang="ru">Принятие решений</name>
		<prof id="ya_sushkov"/>
	</course>
	<course semester="9" year="5" class="с/с" extras="(1)" hours="2" exam="зачет" year_equiv="0.5" alias="sa_simul_stoch_proc_pract">
		<name xml:lang="ru">Моделирование случайных процессов</name>
		<prof id="tm_tovstik"/>
	</course>
	<course semester="10" year="5" class="с/с" extras="(1)" hours="2" exam="зачет" year_equiv="0.5" alias="sa_decision_make_pract">
		<name xml:lang="ru">Постановка задач и принятие решений</name>
		<prof id="ya_sushkov"/>
	</course>
</courses>
